{
  "$schema": "./skills-manifest.schema.json",
  "version": 1,
  "description": "Registry + classification for every skill the template knows about. 'ported' skills physically exist under agent-src/skills/<scope>/<group>/<name>/ and are fanned out by sync.ps1. 'catalogued' skills are classified here so a later sync can pull them from their source repo; they have no local folder yet. 'drop' entries are recorded so the decision is not silently re-litigated.",
  "sourceRoots": {
    "core": "agent-src/skills/core",
    "project": "agent-src/skills/project"
  },
  "targets": {
    "claude": ".claude/skills",
    "copilot": ".github/skills"
  },
  "roundTripToShared": {
    "core": true,
    "project": false,
    "comment": "Only core skills round-trip to the shared product tier (shared/dv). Project skills never sync upstream."
  },
  "defaultTargets": [
    "claude",
    "copilot"
  ],
  "skills": [
    {
      "name": "hso-template-architecture",
      "scope": "drop",
      "group": "foundation",
      "ported": false,
      "source": "HINT",
      "note": "Removed 2026-10-15: not relevant to PPTB tool development. Was: Master template spine; read before any dev work."
    },
    {
      "name": "hso-architecture-map",
      "scope": "drop",
      "group": "foundation",
      "ported": false,
      "source": "shared",
      "note": "Removed 2026-10-15: not relevant to PPTB tool development. Was: TOPO living component topology; bidirectional dependency invariant."
    },
    {
      "name": "hso-agent-help",
      "scope": "core",
      "group": "foundation",
      "ported": false,
      "source": "HINT",
      "note": "Onboarding / skill discovery."
    },
    {
      "name": "hso-init-project",
      "scope": "core",
      "group": "foundation",
      "ported": false,
      "source": "HINT",
      "note": "Project bootstrap / init token engine driver."
    },
    {
      "name": "hso-provision-environment",
      "scope": "core",
      "group": "foundation",
      "ported": false,
      "source": "HINT"
    },
    {
      "name": "hso-dataverse-init-repo",
      "scope": "core",
      "group": "foundation",
      "ported": false,
      "source": "shared"
    },
    {
      "name": "aidevme-shared-scripts",
      "scope": "core",
      "group": "foundation",
      "ported": true,
      "source": "ForgeUSA+shared",
      "note": "Library skill dot-sourced by Dataverse/ADO skills (Invoke-DataverseApi + auth + ProjectConfig). Ported Forge body neutralised to ADR-0003; governance modules (Wiki-Tiers, Resolve-GovernanceContext) deferred to review-later."
    },
    {
      "name": "hso-atlassian-auth",
      "scope": "drop",
      "group": "foundation",
      "ported": false,
      "source": "ForgeUSA",
      "note": "Removed 2026-10-15: not relevant to PPTB tool development. Was: Library skill: Atlassian Cloud Basic-auth headers + settings for the hso-atlassian-* skills. Separate from aidevme-shared-scripts (not an Entra provider)."
    },
    {
      "name": "aidevme-skill-creator",
      "scope": "core",
      "group": "meta",
      "ported": true,
      "source": "HINT",
      "note": "Adds required --scope core|project selector."
    },
    {
      "name": "aidevme-skills-sync",
      "scope": "core",
      "group": "meta",
      "ported": true,
      "source": "HINT",
      "note": "Parity backstop, rewritten for the inverted source-is-committed model; double-nesting bug fixed."
    },
    {
      "name": "skill-creator",
      "scope": "core",
      "group": "delivery",
      "ported": true,
      "source": "upstream",
      "note": "Anthropic upstream base scaffolder. Reclassified meta->delivery to match its on-disk placement (delivery batch). aidevme-skill-creator wraps it and remains in meta."
    },
    {
      "name": "hso-skill-review",
      "scope": "core",
      "group": "meta",
      "ported": false,
      "source": "HINT"
    },
    {
      "name": "hso-skill-path-migration",
      "scope": "core",
      "group": "meta",
      "ported": false,
      "source": "HINT"
    },
    {
      "name": "hso-skill-update-shared-skill",
      "scope": "core",
      "group": "meta",
      "ported": false,
      "source": "shared"
    },
    {
      "name": "hso-template-audit",
      "scope": "core",
      "group": "meta",
      "ported": false,
      "source": "HINT"
    },
    {
      "name": "hso-template-impact-analysis",
      "scope": "core",
      "group": "meta",
      "ported": false,
      "source": "HINT"
    },
    {
      "name": "hso-template-improve",
      "scope": "core",
      "group": "meta",
      "ported": false,
      "source": "HINT"
    },
    {
      "name": "hso-project-upgrade",
      "scope": "core",
      "group": "meta",
      "ported": false,
      "source": "HINT",
      "note": "Diff live project against template; apply safe updates."
    },
    {
      "name": "hso-generated-file-review",
      "scope": "core",
      "group": "meta",
      "ported": false,
      "source": "HINT",
      "note": "Detect hand-edits to generated files."
    },
    {
      "name": "hso-repo-hygiene",
      "scope": "core",
      "group": "meta",
      "ported": false,
      "source": "HINT"
    },
    {
      "name": "hso-project-state-assessment",
      "scope": "core",
      "group": "meta",
      "ported": false,
      "source": "HINT"
    },
    {
      "name": "hso-dataverse-data-modeling",
      "scope": "drop",
      "group": "dataverse",
      "ported": false,
      "source": "HINT+shared",
      "note": "Removed 2026-10-15: not relevant to PPTB tool development. Was: Tables/columns/relationships/choices/solutions via Web API."
    },
    {
      "name": "hso-dataverse-architect",
      "scope": "drop",
      "group": "dataverse",
      "ported": false,
      "source": "shared",
      "note": "Removed 2026-10-15: not relevant to PPTB tool development. Was: Orchestration: analysis + design for Dataverse extensions."
    },
    {
      "name": "aidevme-dataverse-data",
      "scope": "core",
      "group": "dataverse",
      "ported": true,
      "source": "HINT+shared"
    },
    {
      "name": "aidevme-dataverse-customapi",
      "scope": "core",
      "group": "dataverse",
      "ported": true,
      "source": "HINT",
      "note": "aka hso-create-custom-api."
    },
    {
      "name": "hso-dataverse-ui-config",
      "scope": "drop",
      "group": "dataverse",
      "ported": false,
      "source": "HINT+shared",
      "note": "Removed 2026-10-15: not relevant to PPTB tool development. Was: aka hso-dataverse-form-config."
    },
    {
      "name": "hso-dataverse-securityrole",
      "scope": "drop",
      "group": "dataverse",
      "ported": false,
      "source": "HINT",
      "note": "Removed 2026-10-15: not relevant to PPTB tool development."
    },
    {
      "name": "hso-dataverse-naming-conventions",
      "scope": "drop",
      "group": "dataverse",
      "ported": false,
      "source": "HINT",
      "note": "Removed 2026-10-15: not relevant to PPTB tool development."
    },
    {
      "name": "hso-dataverse-bpf",
      "scope": "drop",
      "group": "dataverse",
      "ported": false,
      "source": "shared",
      "note": "Removed 2026-10-15: not relevant to PPTB tool development."
    },
    {
      "name": "hso-dataverse-dashboards",
      "scope": "drop",
      "group": "dataverse",
      "ported": false,
      "source": "shared",
      "note": "Removed 2026-10-15: not relevant to PPTB tool development."
    },
    {
      "name": "hso-dataverse-flow-docs",
      "scope": "drop",
      "group": "dataverse",
      "ported": false,
      "source": "HINT",
      "note": "Removed 2026-10-15: not relevant to PPTB tool development."
    },
    {
      "name": "hso-dataverse-deployment-settings",
      "scope": "core",
      "group": "dataverse",
      "ported": false,
      "source": "shared"
    },
    {
      "name": "hso-dataverse-pipelines",
      "scope": "core",
      "group": "dataverse",
      "ported": false,
      "source": "shared"
    },
    {
      "name": "aidevme-fetchxml-queries",
      "scope": "core",
      "group": "dataverse",
      "ported": true,
      "source": "shared"
    },
    {
      "name": "hso-semantic-data-modeling",
      "scope": "drop",
      "group": "dataverse",
      "ported": false,
      "source": "shared",
      "note": "Removed 2026-10-15: not relevant to PPTB tool development."
    },
    {
      "name": "hso-plugin-development",
      "scope": "drop",
      "group": "server",
      "ported": false,
      "source": "HINT+shared",
      "note": "Removed 2026-10-15: not relevant to PPTB tool development. Was: 4-layer plugin architecture + tests + deploy."
    },
    {
      "name": "hso-plugin-code-review",
      "scope": "core",
      "group": "server",
      "ported": false,
      "source": "HINT+shared"
    },
    {
      "name": "hso-server-framework",
      "scope": "core",
      "group": "server",
      "ported": false,
      "source": "HINT"
    },
    {
      "name": "hso-functions-development",
      "scope": "core",
      "group": "server",
      "ported": false,
      "source": "HINT"
    },
    {
      "name": "hso-powerautomate-writer",
      "scope": "drop",
      "group": "server",
      "ported": false,
      "source": "shared",
      "note": "Removed 2026-10-15: not relevant to PPTB tool development."
    },
    {
      "name": "hso-formscript-development",
      "scope": "drop",
      "group": "client",
      "ported": false,
      "source": "HINT+shared",
      "note": "Removed 2026-10-15: not relevant to PPTB tool development. Was: Upgrade-safe form-script web resources (documented Client API only)."
    },
    {
      "name": "hso-pcf-control-development",
      "scope": "drop",
      "group": "client",
      "ported": false,
      "source": "HINT+shared",
      "note": "Removed 2026-10-15: not relevant to PPTB tool development. Was: PCF controls from spec; pac pcf push."
    },
    {